{"data":{"entities":5448,"forecasts":71,"live_stories":5312,"last_ingest_at":"2026-10-30T05:16:07.768674+00:00","sample_stories":171,"showing_sample":false},"flags":{"kg.history":true,"kg.relations":true,"kg.properties":true,"kg.provenance":true,"kg.schema_map":true},"sectors":[{"id":"energy","icon":"zap","name":"Energy"},{"id":"agri-food","icon":"wheat","name":"Agri and Food"},{"id":"manufacturing","icon":"factory","name":"Manufacturing"},{"id":"logistics-trade","icon":"ship","name":"Logistics and Trade"},{"id":"finance","icon":"landmark","name":"Finance"},{"id":"tech","icon":"cpu","name":"Tech"},{"id":"health","icon":"heart-pulse","name":"Health"},{"id":"real-estate","icon":"building-2","name":"Real Estate"},{"id":"consumer","icon":"shopping-bag","name":"Consumer"}],"sources":[{"id":"news-feeds","name":"Business news feeds","homepage":null,"attribution":"Headlines and links from publishers and official bodies; each story names and links its outlet"},{"id":"crowd-forecasts","name":"Crowd forecast providers","homepage":null,"attribution":"Crowd forecasts: each one names its provider"},{"id":"gdacs","name":"GDACS","homepage":"https://www.gdacs.org","attribution":"Disaster alerts: GDACS (European Commission and United Nations)"},{"id":"gdelt","name":"GDELT Project","homepage":"https://www.gdeltproject.org","attribution":"News signals: The GDELT Project"},{"id":"manifold","name":"Manifold","homepage":"https://manifold.markets","attribution":"Crowd forecasts: Manifold (play money)"},{"id":"natural-earth","name":"Natural Earth","homepage":"https://www.naturalearthdata.com","attribution":"Borders and places: Natural Earth"},{"id":"usgs","name":"USGS Earthquake Hazards Program","homepage":"https://earthquake.usgs.gov","attribution":"Earthquakes: U.S. Geological Survey"},{"id":"curated","name":"WorldGraph curated","homepage":null,"attribution":"Reference entities and links: compiled by WorldGraph from public sources"},{"id":"sample","name":"WorldGraph sample data","homepage":null,"attribution":"Sample stories and forecasts are invented and labelled as samples"}],"generated_at":"2026-10-30T05:36:29.618422+00:00"}
